{
  "$schema": "https://spec.denna.io/v1/safe/staking-config.schema.json",
  "metadata": {
    "id": "safe-staking-mainnet",
    "name": "Safenet Beta Staking — Ethereum Mainnet",
    "kind": "io.safe.staking-config",
    "description": "Production Safenet Beta staking contracts on Ethereum mainnet, used by the Denna Labs operator UI.",
    "version": "1.0.0",
    "lastUpdated": "2026-05-14",
    "tags": ["safe", "staking", "mainnet", "track-a"],
    "source": {
      "repository": "github.com/safe-fndn/safenet-staking-ui",
      "references": ["src/constants.ts"]
    }
  },
  "chainId": 1,
  "chainName": "ethereum",
  "deployBlock": 0,
  "contracts": {
    "staking": {
      "value": "0x115E78f160e1E3eF163B05C84562Fa16fA338509",
      "format": "evm"
    },
    "safeToken": {
      "value": "0x5aFE3855358E112B5647B952709E6165e1c1eEEe",
      "format": "evm"
    },
    "sanctionsOracle": {
      "value": "0x40C57923924B5c5c5455c48D93317139ADDaC8fb",
      "format": "evm"
    }
  },
  "validators": [],
  "rewards": {
    "claimWindowSeconds": 0
  },
  "features": {
    "eip5792Batch": true,
    "geoBlock": false,
    "sanctionsGate": true
  }
}
