{
  "$schema": "https://spec.denna.io/v1/safe/staking-config.schema.json",
  "metadata": {
    "id": "safe-staking-sepolia",
    "name": "Safenet Beta Staking — Sepolia Testnet",
    "kind": "io.safe.staking-config",
    "description": "Sepolia testnet Safenet Beta staking contracts. Used for E2E and demos.",
    "version": "1.0.0",
    "lastUpdated": "2026-05-14",
    "tags": ["safe", "staking", "sepolia", "testnet"],
    "source": {
      "repository": "github.com/safe-fndn/safenet-staking-ui",
      "references": ["src/constants.ts"]
    }
  },
  "chainId": 11155111,
  "chainName": "sepolia",
  "deployBlock": 0,
  "contracts": {
    "staking": {
      "value": "0x40745eec3fD6E4C005de1dec0031b2EA9f9D7c42",
      "format": "evm"
    },
    "safeToken": {
      "value": "0xef98bcc90b1373b2ae0d23ec318d3ee70ea61af4",
      "format": "evm"
    }
  },
  "validators": [],
  "features": {
    "eip5792Batch": true,
    "geoBlock": false,
    "sanctionsGate": false
  }
}
